喝酒臉紅是癌症警訊！多喝一口酒 你和5種癌症、心臟病、失智症更近了,https://health.tvbs.com.tw/medical/327904,醫療,醫療焦點,,
收納同時做「這事」會更糟，可惜很多人都不知！達人教你「空間歸零」法,https://health.tvbs.com.tw/life/327866,樂生活,過好日子,,
女性偏頭痛是男性3倍！圖解12個解痛穴位 多吃堅果、綠色蔬菜有好處,https://health.tvbs.com.tw/regimen/327903,中醫,穴位保健,,
睡覺老被蚊子叮，原來沒洗腳！專家曝蚊子有3個最愛，別讓牠愛上你,https://health.tvbs.com.tw/life/327902,樂生活,過好日子,,
過勞真的會死！「攬雀尾」徹底消除疲勞、穩定血壓,https://health.tvbs.com.tw/regimen/327897,運動,氣功調氣,,
辛曉琪眼球爆血管 醫曝若太常發生恐是中風徵兆,https://health.tvbs.com.tw/medical/327901,醫療,健康星聞,,
全身筋膜超緊繃！「拉筋」8招舒緩痠痛僵硬、重塑肌肉筋膜彈性,https://health.tvbs.com.tw/regimen/327900,運動,瑜伽伸展,,
吃蘆筍正當時！防大腸癌、防高血壓、強化血管…挑水嫩蘆筍看3部位,https://health.tvbs.com.tw/nutrition/327899,營養,挑好食材,,
肉鬆吃多會致癌？經過加工營養還在嗎？專家教你「看兩眼」挑好貨,https://health.tvbs.com.tw/nutrition/327898,營養,挑好食材,,
為何糖尿病、心臟病患這麼多？醫學博士曝「飯後血糖」是關鍵 點名1種元凶食物,https://health.tvbs.com.tw/medical/327896,醫療,醫療焦點,,
甲狀腺疾病好發女性！甲狀腺癌治癒率高嗎？不留疤有方法,https://health.tvbs.com.tw/medical/327895,醫療,醫療焦點,,
5種舌苔狀態看脾胃健康！這種顏色代表消化順暢、胃氣正合適,https://health.tvbs.com.tw/regimen/327894,養生,養生保健,,
夫妻同時得巴金森氏症 但有沒有吃藥，結局差很大！,https://health.tvbs.com.tw/medical/327893,醫療,醫療焦點,,
再增2名機師確診！華航恐成第二個部桃？陳時中這樣回應,https://health.tvbs.com.tw/medical/327892,醫療,防疫快遞,,
研究發現：心臟有力、沒高血壓且長壽者，身上有1個「特徵」,https://health.tvbs.com.tw/regimen/327891,養生,養生保健,,
蔬果汁怎麼喝最好？營養師大推「帶皮蔬果汁」燃脂、補鈣、通便 做錯1步驟營養流失,https://health.tvbs.com.tw/nutrition/327889,營養,營養對策,,
擠額頭上的痘痘要小心！27歲的她流膿不止，竟腦硬膜下積水,https://health.tvbs.com.tw/medical/327890,醫療,醫療焦點,,
瑜伽是全世界最好的運動！復健科醫師警告「3動作別亂做」,https://health.tvbs.com.tw/regimen/327888,運動,瑜伽伸展,,
130/85mmHg已是高血壓前期！高血壓、高風險族群 量血壓用「722」,https://health.tvbs.com.tw/medical/327887,醫療,醫療焦點,,
換季濕氣重容易頭暈、耳鳴發作！彥寬老師「護耳功」 幫你打開身體除濕機,https://health.tvbs.com.tw/regimen/327886,運動,氣功調氣,,
雪碧汽水涼拌黃瓜好吃！營養師：可樂、汽水、沙士也可以，但別用這種,https://health.tvbs.com.tw/life/327881,營養,營養對策,,
吃飯別常配這種魚！台大醫曝罹癌機率高7倍,https://health.tvbs.com.tw/medical/327842,影音,名醫觀點,癌症,癌症飲食
名人婚變提出離婚訴訟，孩子何去何從？不倫者不一定輸，律師說撫養權重點是「這個」,https://health.tvbs.com.tw/life/327883,樂生活,親子家庭,,
一週7名機師確診！英國變異株傳染力增50％ 研究：AZ疫苗仍有效,https://health.tvbs.com.tw/medical/327885,醫療,防疫快遞,,
台灣首例！男子在防疫旅館猝死，證實染新冠肺炎！機師染疫再增1名,https://health.tvbs.com.tw/medical/327884,醫療,防疫快遞,,
4/23世界閱讀日！如何陪孩子閱讀效果最好？鄭凱云經驗大分享,https://health.tvbs.com.tw/life/327880,樂生活,親子家庭,,
9大超實用YouTube使用技巧！手機看影片不用錢、影片講太快不煩惱,https://health.tvbs.com.tw/life/327879,樂生活,過好日子,,
人脈真相！按讚數多、好友多，就是社交達人？不懂這一點，社交就是無效,https://health.tvbs.com.tw/life/327877,樂生活,過好日子,,
煎蛋關鍵在蔥花長度！名廚教你3步驟煎出蓬鬆好吃「鮪魚蔥蛋」,https://health.tvbs.com.tw/life/327876,食譜,滋補菜,影音,挖健康
「國民阿嬤」陳淑芳公開養生祕訣！生菜拌好油直接吃 但她很少吃3食物,https://health.tvbs.com.tw/life/327875,養生,名人養生,,
本土病例再起！華航機師兒子確診 台北清真寺400人活動群聚調查中,https://health.tvbs.com.tw/medical/327872,醫療,防疫快遞,,
為什麼我都不懷孕？有月經不見得一定有卵！不孕症檢查你做了嗎？,https://health.tvbs.com.tw/medical/327873,醫療,醫療焦點,,
早餐吃「鹹粥」也不健康？營養師曝驚人熱量！「3有、1沒有」吃出活力,https://health.tvbs.com.tw/nutrition/327871,營養,營養對策,,
手上腫一包是癌症嗎？腱鞘囊腫復發率50％！醫師建議護手3件事,https://health.tvbs.com.tw/medical/327870,影音,挖健康,醫療,醫療焦點
台股爆歷史新天量盤勢將反轉？快學巴菲特、索羅斯選股法,https://health.tvbs.com.tw/life/327869,樂生活,過好日子,,
骨刺會造成足底筋膜炎？如何治療最好？物理治療師告訴你,https://health.tvbs.com.tw/medical/327868,醫療,醫療焦點,,
鼓鼓自曝「媽媽失智了」 全台每80人就有1人！遠離失智症這樣做,https://health.tvbs.com.tw/medical/327865,醫療,健康星聞,,
量血壓「1關鍵數值」暗示你動脈硬化！江坤俊提醒：2個時間千萬不要量血壓,https://health.tvbs.com.tw/medical/327867,影音,江P醫件事,醫療,醫療焦點
先生說要辭職怎麼辦？這3句話千萬不能說,https://health.tvbs.com.tw/life/327863,樂生活,親子家庭,,
6旬婦「啤酒肚」像孕婦 驚覺代誌大條！C肝治療12週恢復正常,https://health.tvbs.com.tw/medical/327861,醫療,醫療焦點,,
飆捍館長驚爆糖尿病前期！身強體壯也會有糖尿病？快做3件事可逆轉,https://health.tvbs.com.tw/medical/327862,醫療,健康星聞,,
不要拿「我說話比較直」當藉口！這不是「誠實」 暗藏4種負面人格,https://health.tvbs.com.tw/regimen/327858,樂生活,心靈雞湯,,
「妳舒不舒服？」兩性專家曝6句話做愛不能問 問完瞬間無感,https://health.tvbs.com.tw/life/327859,樂生活,親子家庭,,
減肥總是無效？中醫師分析４種原因，你是哪一種？,https://health.tvbs.com.tw/medical/327857,中醫,穴位保健,,
腳跟痛不一定是足底筋膜炎！醫師告訴你怎麼回事，4點防腳跟痛,https://health.tvbs.com.tw/medical/327855,醫療,醫療焦點,,
想要一夜好眠！ 床墊達人教你分辨天然乳膠床墊,https://health.tvbs.com.tw/Guangbian/327856,廣告業務,,,
她全身僵直20年治癒了！「深腦刺激術」不只治療帕金森 這些疾病也適用,https://health.tvbs.com.tw/medical/327854,醫療,醫療焦點,,
「高年級」男生吃感冒藥得小心！他買成藥吃，３天後竟尿不出來,https://health.tvbs.com.tw/medical/327853,醫療,醫療焦點,,
肺癌免疫治療大突破！去甲基化藥物助攻特殊T細胞 大幅延長存活率,https://health.tvbs.com.tw/medical/327852,癌症,抗癌醫學,,
造福婦科、頭頸、腸胃道及皮膚癌患者！「3D近距離放射治療」精準摧毀癌細胞,https://health.tvbs.com.tw/medical/327850,癌症,抗癌醫學,,
母愛真偉大！她飛越半個地球只為捐腎救子,https://health.tvbs.com.tw/medical/327851,醫療,醫療焦點,,
動不動就閃到腰？打造「天然護腰」快來做３組動作，不傷膝又美化腰身,https://health.tvbs.com.tw/review/327849,影音,節目精華,運動,瑜伽伸展
心理師都在做「身體掃描呼吸」！每天15分鐘 釋放壓力、遠離焦慮,https://health.tvbs.com.tw/regimen/327846,養生,養生保健,,
事前全無症狀！女星林立雯驚傳視網膜破孔 提醒高度近視者必做這件事,https://health.tvbs.com.tw/medical/327845,醫療,健康星聞,,
腰痛治不好？1招自我檢測「核心無力」 每天10分鐘鍛鍊核心肌群,https://health.tvbs.com.tw/regimen/327847,養生,養生保健,,
綠拿鐵喝錯，高血脂、高血糖、癌細胞找上你！專家揭「完美比例」抗癌抗發炎,https://health.tvbs.com.tw/nutrition/327848,營養,營養對策,,
盜汗、無力不一定是中暑！30年老菸槍每天1.5包菸心肌梗塞上身,https://health.tvbs.com.tw/medical/327844,醫療,醫療焦點,,
頂級天菜金希澈支氣管受損，自曝後悔學生時代吸菸 醫教逆轉搶救法,https://health.tvbs.com.tw/medical/327843,醫療,健康星聞,,
「睡姿」不只影響頭形，頭形畸形小心影響腦部！6月嬰「戴頭盔」矯正,https://health.tvbs.com.tw/medical/327841,醫療,醫療焦點,,
發燒嘔吐不是感冒！這種傳染病24小時內恐致命 小心無症狀帶原者,https://health.tvbs.com.tw/medical/327840,醫療,醫療焦點,,
肩膀愈不動愈容易得「五十肩」！３個日常保養原則，不卡「關」,https://health.tvbs.com.tw/medical/327838,養生,養生保健,,
另一半偷吃有跡可循！命理專家曝5星座最容易外遇 快學破解方法,https://health.tvbs.com.tw/life/327837,樂生活,命理星座,,
泡茶該放多少茶葉？紅茶、綠茶、普洱茶、烏龍茶黃金比例大公開,https://health.tvbs.com.tw/life/327836,營養,挑好食材,,
眩暈又發作！手指按5穴緩解噁心想吐 1杯薄荷茶解暈又舒心,https://health.tvbs.com.tw/regimen/327835,中醫,穴位保健,,
新竹炒米粉紅到美國！炒米粉好吃的秘訣是肉燥 1個小技巧讓美味與健康更升級,https://health.tvbs.com.tw/nutrition/327834,營養,挑好食材,,
不會痛的才恐怖！老翁輸尿管結石不理會恐要洗腎 5種人「對痛不敏感」要注意,https://health.tvbs.com.tw/medical/327833,醫療,醫療焦點,,
愛情保鮮祕訣！日常3個小動作 讓感情持續加溫、婚姻美滿,https://health.tvbs.com.tw/life/327831,樂生活,親子家庭,,
彭佳慧曝膝關節囊腫腳麻麻...醫師說根治要這樣做，否則復發率高,https://health.tvbs.com.tw/medical/327832,醫療,健康星聞,,
恆春洋蔥甘甜多汁！日本國寶級料理家大推「整顆洋蔥湯」 快速消除疲勞、恢復體力,https://health.tvbs.com.tw/nutrition/327830,營養,營養對策,,
吃飽就想睡，原因出在這裡！營養師6招提神飲食，不再昏昏欲睡,https://health.tvbs.com.tw/nutrition/327829,營養,營養對策,,
吃西藥會傷胃 最好配胃藥一起吃？小心反而傷胃又傷腎！,https://health.tvbs.com.tw/medical/327827,醫療,醫療焦點,,
吳慷仁急性扁桃腺炎住院 睡眠不足的人小心了！,https://health.tvbs.com.tw/medical/327828,醫療,健康星聞,,
保健雙峰、瘦手臂靠這招！天天做「乳房按摩操」 暢通淋巴、預防乳癌,https://health.tvbs.com.tw/review/327825,影音,節目精華,運動,瑜伽伸展
好焦慮！一咳就漏、飄異味 她「這樣治」2個月就能安心出門,https://health.tvbs.com.tw/medical/327826,醫療,醫療焦點,,
《當男人戀愛時》男主角突然流鼻血 竟是腦動脈瘤！醫師曝真相是…,https://health.tvbs.com.tw/medical/327824,醫療,健康星聞,,
疑有不純物，200萬顆降血脂藥下架！台大醫：不靠藥物降膽固醇3關鍵,https://health.tvbs.com.tw/medical/327823,醫療,醫療焦點,,
浴室潮濕不通風 黴菌、水垢、異味、小飛蟲通通來！家事達人教你3招變清爽,https://health.tvbs.com.tw/life/327821,樂生活,過好日子,,
用AI輔助外傷影像診斷，秒抓「骨折致命出血點」 林口長庚開創新紀元,https://health.tvbs.com.tw/medical/327822,醫療,醫療焦點,,
吳宗憲、任容萱拔牙臉腫像含滷蛋！醫曝拔這種牙齒最容易臉腫 2步驟快速消腫,https://health.tvbs.com.tw/medical/327820,醫療,健康星聞,,
甩掉下半身腫脹！ 2套淋巴引流消水腫、提升代謝力 活化脊椎又瘦腿,https://health.tvbs.com.tw/review/327819,影音,節目精華,運動,瑜伽伸展
喝茶能減肥？喝了就不易形成體脂肪？營養師揭「一定瘦」10個祕訣,https://health.tvbs.com.tw/nutrition/327818,養生,聰明減肥,,
27歲男嚴重心律不整 一發作就低血壓！醫師用這招讓他心臟不再「黑白跳」,https://health.tvbs.com.tw/medical/327817,醫療,醫療焦點,,
早餐吃什麼最好？名中醫師曝1種食物最傷胃 3種食物最推薦,https://health.tvbs.com.tw/nutrition/327816,營養,挑好食材,,
「穀雨」防濕邪要早睡早起！練1招助好眠、提升免疫力 為夏天養生打底,https://health.tvbs.com.tw/regimen/327815,養生,養生保健,,
忽冷忽熱最容易傷風感冒！「調息吐納」暢通任督二脈 增強免疫力、預防感冒,https://health.tvbs.com.tw/regimen/327813,運動,氣功調氣,,
奶水不足吃豬腳花生有效？泌乳專家破解10大迷思 「這姿勢」母嬰都輕鬆,https://health.tvbs.com.tw/medical/327814,樂生活,親子家庭,,
碗盤油膩膩、衣服沾油漬好難清洗？1招輕鬆去除油垢、油漬,https://health.tvbs.com.tw/life/327812,樂生活,過好日子,,
維生素D也是「瘦身維生素」！這食物「吃一撮」打造易瘦體質,https://health.tvbs.com.tw/nutrition/327811,營養,營養對策,,
X,https://health.tvbs.com.tw/medical/327810,廣告業務,,,
8旬翁膝關節退化，該換人工關節嗎？醫師建議1種人「換半套」效果好,https://health.tvbs.com.tw/medical/327809,醫療,醫療焦點,,
一痛就吃止痛藥可以嗎?藥師曝「這種」過量會傷肝 孕婦等５種人要特小心,https://health.tvbs.com.tw/medical/327808,醫療,醫療焦點,,
輕熟女疲倦喝提神飲料也沒用竟是血癌！醫師宣判只剩3個月 她做2件事抗癌成功,https://health.tvbs.com.tw/medical/327807,癌症,抗癌醫學,,
10種水果遠離腸躁症！「低腹敏飲食」改善腹痛、腹瀉、便祕 營養師教你這樣吃,https://health.tvbs.com.tw/nutrition/327806,營養,營養對策,,
吃對5種食物改善「腰痠背痛」！中醫食療幫你抬頭挺胸、打直腰桿,https://health.tvbs.com.tw/medical/327804,養生,養生保健,,
千萬別用毛巾擦乾皮膚！止癢、預防濕疹發作 醫師大推「濕敷療法」,https://health.tvbs.com.tw/review/327803,影音,節目精華,養生,養生保健
男神吳彥祖的額頭怎麼愈來愈高？雄性禿、一般落髮可以「這樣」救,https://health.tvbs.com.tw/medical/327805,醫療,健康星聞,,
「異常頭痛」小心中風！她左半身突然無力，才發現腦內血管畸形,https://health.tvbs.com.tw/medical/327802,醫療,醫療焦點,,
血壓正常≠心臟沒病！走路喘、走不遠 別再以為正常老化,https://health.tvbs.com.tw/medical/327801,影音,名醫觀點,醫療,醫療焦點
3件事預防腎結石！體外震波碎石近30次仍復發？1次手術解決2顆結石,https://health.tvbs.com.tw/medical/327800,醫療,醫療焦點,,
1天沒喝咖啡就不舒服？警覺「這種症狀」，咖啡因過多小心心律不整,https://health.tvbs.com.tw/medical/327799,營養,挑好食材,,
金曲歌王罹病逾20年！全台千人與血友病共存 他50歲竟能日行10公里,https://health.tvbs.com.tw/medical/327798,醫療,健康星聞,,
年過40腰痠、膝軟可能骨鬆了！彥寬老師「納氣功」 補腎氣、腰腿都有力,https://health.tvbs.com.tw/regimen/327797,運動,氣功調氣,,
增陽氣、補維他命D要曬「陽面」！名中醫：選這幾個部位做日光浴最好,https://health.tvbs.com.tw/regimen/327786,養生,養生保健,,
口乾、口臭、冒痘痘…春天火氣大 醫師大推3種蔬果好退火,https://health.tvbs.com.tw/regimen/327785,營養,營養對策,,
肩膀是全身最勞累關節！7分鐘改善肩痛僵硬、放鬆關節不受傷,https://health.tvbs.com.tw/regimen/327796,影音,節目精華,運動,瑜伽伸展
「你的心臟沒有神經喔…」醫師看似無厘頭的笑話，卻讓他溺水求生半年,https://health.tvbs.com.tw/medical/327795,醫療,醫療焦點,,
56年來最大旱災！1個小動作抗旱省水，「這種水」最好不要喝,https://health.tvbs.com.tw/life/327791,影音,如果云知道,樂生活,過好日子
太魯閣號捐款10.6億元採現金給付 罹難者1500萬元、重傷最高700萬元,https://health.tvbs.com.tw/medical/327792,樂生活,過好日子,,
沒「乖乖」電腦就罷工？台灣電腦保護神紅到國外 看星相老師曝「乖乖」祕密,https://health.tvbs.com.tw/life/327793,樂生活,命理星座,,
打過B肝疫苗為何沒有抗體？需要補打嗎？醫師說1種人才需要,https://health.tvbs.com.tw/medical/327788,醫療,醫療焦點,,
荸薺加蔥煮湯喝，能排結石?醫師曝最簡有效是「它」,https://health.tvbs.com.tw/medical/327787,醫療,醫療焦點,,
運動後怎麼吃？蛋白質、碳水化合物最佳比例 4道料理讓身心都滿足了,https://health.tvbs.com.tw/nutrition/327784,營養,營養對策,,
又到了夏天甩肉大作戰！針灸有效消除腹部脂肪、縮減腰圍、改善代謝,https://health.tvbs.com.tw/medical/327783,養生,聰明減肥,,
國衛院發現抗癌「鬼滅基因」！有效阻絕攝護腺癌轉移 蜂膠萃取物有幫助,https://health.tvbs.com.tw/medical/327782,癌症,抗癌醫學,,
「這樣呼吸」調整自律神經，改善鼻過敏、肺纖維化！專科醫師教你做,https://health.tvbs.com.tw/medical/327781,養生,養生保健,,
他聲音沙啞99天，醫師只用1天就治癒！「單側聲帶麻痹」可以不動刀,https://health.tvbs.com.tw/medical/327780,醫療,醫療焦點,,
他高燒3天不退竟是「最致命血癌」！平均少活17.5年 台大醫師曝身體出現4徵兆不單純,https://health.tvbs.com.tw/medical/327779,癌症,抗癌醫學,,
腳底痠痛別亂按摩！醫曝按錯恐引發足底筋膜炎 1招「腳底保養術」快速舒緩,https://health.tvbs.com.tw/medical/327778,影音,挖健康,養生,養生保健
體重暴增小心內分泌異常！她臉變圓、後頸變厚都是「腎上腺腫瘤」害的,https://health.tvbs.com.tw/medical/327777,醫療,醫療焦點,,
女星瘦身都在做 瘦成「螞蟻腰」！5分鐘HIIT運動快速燃脂 勝過慢跑半小時,https://health.tvbs.com.tw/regimen/327776,影音,挖健康,運動,健身運動
不只降血糖！「2種運動」預防糖尿病血管病變、血液順暢還能減肥,https://health.tvbs.com.tw/regimen/327775,養生,養生保健,,
沒跌倒為何屁股好痛？髖關節問題難診斷 可能和疝氣、婦科疾病有關！,https://health.tvbs.com.tw/medical/327774,醫療,醫療焦點,,
59歲「不老天王」的菜單大公開 劉德華保持凍齡的祕訣原來如此,https://health.tvbs.com.tw/nutrition/327773,養生,名人養生,,
保險套這樣用會出人命！兩性專家曝6種保險套錯誤觀念,https://health.tvbs.com.tw/life/327772,樂生活,親子家庭,,
骨頭痛竟罹攝護腺癌險癱！醫曝老男人尿尿3症狀 恐是癌徵兆,https://health.tvbs.com.tw/medical/327771,癌症,抗癌醫學,,
動脈有沒有阻塞，觀察自己的腳趾頭！7種人是「周邊動脈阻塞」高危險群,https://health.tvbs.com.tw/medical/327769,醫療,醫療焦點,,
3個特效穴養子宮！子宮肌瘤一定得開刀嗎？醫師曝判斷準則,https://health.tvbs.com.tw/review/327768,影音,節目精華,中醫,穴位保健
女神都有蝴蝶背？迪麗熱巴有絕美蝴蝶背 名醫曝其實有原因，鐵定常背痛,https://health.tvbs.com.tw/life/327770,醫療,醫療焦點,,
哪個恐怖惡習害廖峻中風？外出怕跑廁所、怕夜尿不敢喝水 易陷中風危機,https://health.tvbs.com.tw/life/327767,醫療,健康星聞,,
皮膚缺水、泛油、冒痘痘…換季皮膚糟透了！養出水嫩美肌3件事,https://health.tvbs.com.tw/regimen/327765,養生,養生保健,,
不需劇烈運動就能鍛鍊下半身！「柔性深蹲」一天10次就能練肌肉,https://health.tvbs.com.tw/regimen/327764,運動,瑜伽伸展,,
減肥碰到停滯期？醫師教你1招，增加代謝率繼續往下瘦,https://health.tvbs.com.tw/review/327762,影音,節目精華,養生,聰明減肥
皮膚過敏要勤清潔消滅壞菌？ 阿包醫師破解父母對過敏肌3個NG 觀點,https://health.tvbs.com.tw/medical/327763,醫療,醫療焦點,,
脂漏性皮膚炎是因為出油多？醫師解析關鍵原因！7招減緩發作,https://health.tvbs.com.tw/medical/327761,醫療,醫療焦點,,
老人稱呼會影響生活品質！叫阿公阿嬤、大哥大姊 還是帥哥美女比較好？,https://health.tvbs.com.tw/life/327760,壯世代,熟年情報,,
「補血聖藥」阿膠 養肝、顧肺、強筋骨！搭配3食效果更佳 老中醫曝調理更年期要這樣吃,https://health.tvbs.com.tw/nutrition/327759,中醫,藥膳茶飲,,
不准男友和女同事打招呼！韓女星遭爆料「控制欲強」 專家剖析背後原因,https://health.tvbs.com.tw/regimen/327758,醫療,健康星聞,,
想健康長壽，蔬果不是吃愈多愈好！哈佛大數據研究：每天這樣吃最完美,https://health.tvbs.com.tw/regimen/327756,營養,挑好食材,,
「這種」心律不整中風機率高5倍！新療法「左心耳封堵術」可有效預防,https://health.tvbs.com.tw/medical/327757,醫療,醫療焦點,,
全球首度發現！「戈氏副擬桿菌」可逆轉肺阻塞 多吃2中藥有效,https://health.tvbs.com.tw/medical/327755,醫療,醫療焦點,,
1分鐘眼睛保養操：溫熱雙眼解疲勞、不讓老花眼疾找上門,https://health.tvbs.com.tw/regimen/327754,養生,養生保健,,
車禍造成主動脈斷裂，有8成死亡率！重傷男子撿回一命,https://health.tvbs.com.tw/medical/327753,醫療,醫療焦點,,
AZ疫苗開放自費施打！自費最高價格曝光 全台31家醫院可預約,https://health.tvbs.com.tw/medical/327752,醫療,防疫快遞,,
老翁便祕7天竟是大腸癌！1種治療免做人工肛門 解決腸阻塞可正常排便,https://health.tvbs.com.tw/medical/327751,癌症,抗癌醫學,,
不只聽力受損，噪音影響全身！小心中風、心臟病、胃潰瘍、憂鬱症上身,https://health.tvbs.com.tw/medical/327750,醫療,醫療焦點,,
臭豆腐VS.蚵仔煎 15種國民美食熱量排名！營養師曝「熱量炸彈」是它,https://health.tvbs.com.tw/nutrition/327749,營養,挑好食材,,
「5種水果」減少關節發炎！關節退化常痠痛？醫師公開4類食療,https://health.tvbs.com.tw/nutrition/327748,營養,營養對策,,
他罹肝癌被宣判生命剩不到1年！天天練「平甩功」找到修練法門,https://health.tvbs.com.tw/regimen/327745,,,,
2、30歲竟心肌梗塞猝死！醫師曝2大關鍵原因 1危險徵兆別輕忽,https://health.tvbs.com.tw/medical/327743,醫療,醫療焦點,,
100歲竟有「30歲大腦」，揭日本健腦祕訣！醫師1招「手指操」也能活腦,https://health.tvbs.com.tw/review/327747,影音,節目精華,養生,養生保健
健康長壽關鍵4字訣！養生名醫教你慢呼吸 切換腦波、減少能量消耗,https://health.tvbs.com.tw/life/327746,運動,氣功調氣,,
半數洗腎患者心臟衰竭喪命！北榮研發AI預測系統 準確度達90％,https://health.tvbs.com.tw/medical/327744,醫療,醫療焦點,,
瘦身減重、增肌減脂要吃雞胸肉！吃膩了水煮雞胸肉？2種吃法快速上桌,https://health.tvbs.com.tw/life/327741,營養,營養對策,,
月經還沒來就腹痛腰痠 中醫推「一茶一式」舒緩肌筋膜 告別疼痛 助好孕,https://health.tvbs.com.tw/medical/327742,中醫,藥膳茶飲,,
吃豆養生別吃錯！營養師曝「這種豆製品」比紅肉傷身 減肥最推薦3種豆,https://health.tvbs.com.tw/nutrition/327740,營養,挑好食材,養生,聰明減肥
「痛苦歌王」孫情一餐2碗飯、可樂當水喝！血糖飆破400 醫師曝可能後果,https://health.tvbs.com.tw/medical/327739,醫療,健康星聞,,
蜂蜜吃不完放冰箱？保存只有這1招！專家提醒：蜂蜜水喝錯，小心睡不好！,https://health.tvbs.com.tw/nutrition/327738,營養,挑好食材,,
別把胃痛當習慣！胰臟疾病容易誤認是胃疾 健檢揪出5公分腫瘤,https://health.tvbs.com.tw/medical/327737,醫療,醫療焦點,,
彰化市長半夜腹痛掛急診 除了多喝水，預防結石還要「它」！但很多人都誤解,https://health.tvbs.com.tw/medical/327736,醫療,健康星聞,,
燕麥對抗三高、避免過敏、瘦身不復胖！1種吃法 趕走壞膽固醇、遠離慢性病,https://health.tvbs.com.tw/nutrition/327735,營養,營養對策,,
「想跟奶奶一樣死掉…」孩子經歷重大變故後有退化行為，可能是憂鬱症,https://health.tvbs.com.tw/medical/327734,醫療,醫療焦點,,
遠離五十肩！3招簡易運動矯正肩關節 抬頭挺胸不駝背、關節不卡卡,https://health.tvbs.com.tw/review/327731,影音,節目精華,運動,瑜伽伸展
騎腳踏車可改善帕金森氏症手抖、小碎步 權威醫師：這樣運動效果越好,https://health.tvbs.com.tw/medical/327733,養生,養生保健,,
「小象隊」近況曝光 肥胖真的要人命！1人糖尿病過世、1人罹癌 院長級台大減重名醫傳授「減肥良方」,https://health.tvbs.com.tw/medical/327730,醫療,健康星聞,,
眼睛疲勞當心視力惡化！「眼觀四方」暢通眼周 改善眼袋、黑眼圈,https://health.tvbs.com.tw/regimen/327725,壯世代,減齡變年輕,,
她失語又失憶竟是癲癇發作！吃藥、加馬刀都無效，幸有新利器讓她重生,https://health.tvbs.com.tw/medical/327732,醫療,醫療焦點,,
「智齒」也能救缺牙！智齒該拔嗎？2種情況建議盡早拔除,https://health.tvbs.com.tw/medical/327729,醫療,醫療焦點,,
