網紅愛莉莎莎自曝天天蕁麻疹、吃藥睡整天 醫師說別停藥，這樣做才能「斷根」,https://health.tvbs.com.tw/medical/328884,醫療,健康星聞,,
「微解封」外出運動前 醫曝記得幫膝蓋超前部署「這招」每周２次就有效,https://health.tvbs.com.tw/medical/328883,養生,養生保健,,
一天要喝多少水？喝膩白開水喝茶、咖啡可以嗎？營養師推薦2款「蔬果風味水」 幫助利尿、消水腫,https://health.tvbs.com.tw/regimen/328881,養生,養生保健,,
微解封首日 全台2廟宇可參拜，還有這些廟宇審核中,https://health.tvbs.com.tw/life/328882,醫療,防疫快遞,,
天熱來杯康普茶！營養師推薦「減肥健康飲料」 減脂、防便祕、趕走壞心情,https://health.tvbs.com.tw/nutrition/328879,養生,聰明減肥,,
COVID-19疫苗開放「18歲以上」意願登記！AZ、莫德納都可以選,https://health.tvbs.com.tw/medical/328880,醫療,防疫快遞,,
輝瑞BNT疫苗要來了！長輩施打防護力如何？疫苗效力和年齡有關嗎？,https://health.tvbs.com.tw/medical/328878,醫療,醫療焦點,,
大腸癌與便祕有關？3穴位改善便祕 避免痔瘡、肛裂、大腸憩室炎,https://health.tvbs.com.tw/regimen/328852,中醫,穴位保健,,
感謝3大機構買到BNT！陳文茜籲：「一人一劑」建立科學防疫網,https://health.tvbs.com.tw/medical/328877,醫療,防疫快遞,,
一機兩用「自動噴酒精順便量手溫」真能測出有沒有發燒？食藥署解答了,https://health.tvbs.com.tw/medical/328875,醫療,醫療焦點,,
主動脈疾病患者別亂用FQ抗生素！長庚研究：手術、猝死風險倍增,https://health.tvbs.com.tw/medical/328876,醫療,醫療焦點,,
阿滴憂鬱症「光活著就用盡力氣」 分享這5件事對他康復幫助很大,https://health.tvbs.com.tw/medical/328874,醫療,健康星聞,,
訓練心肺耐力，不用跑跑跳跳！低衝擊有氧動作 強化心肺功能不傷膝,https://health.tvbs.com.tw/regimen/328873,運動,健身運動,,
視網膜剝離卻因檢疫中險被「拋棄」 臺中慈濟伸援手救視力，病患捐20萬助人,https://health.tvbs.com.tw/medical/328872,醫療,醫療焦點,,
新莊清潔工確診9人染疫！新北市65歲以上莫德納疫苗 剩2萬3718人可預約,https://health.tvbs.com.tw/medical/328871,醫療,防疫快遞,,
今日本土+23，集中在雙北！陳時中提醒：莫德納第2劑接種間隔注意,https://health.tvbs.com.tw/medical/328869,醫療,防疫快遞,,
比利時嬤同時染2種變種病毒，短短5天去世 醫師提醒得這樣做才能防病毒,https://health.tvbs.com.tw/medical/328870,醫療,防疫快遞,,
下載「健康2.0」APP，多項好禮等你抽！(得獎名單已公布於此頁末),https://health.tvbs.com.tw/life/328868,無,,,
早上就喝「空心菜牛奶」！營養師曝空心菜1吃法 降血糖、降血壓、排便更順暢,https://health.tvbs.com.tw/nutrition/328867,營養,挑好食材,,
打新冠疫苗會變成「萬磁王」？醫解析：這種人皮膚符合2種條件,https://health.tvbs.com.tw/medical/328865,醫療,醫療焦點,,
2歲娃把鈕釦電池當玩具塞鼻腔！醫曝單側鼻塞等4症狀是鼻子有異物，非鼻過敏,https://health.tvbs.com.tw/medical/328866,醫療,醫療焦點,,
營養師曝8招肥胖不上身！「餐前喝水」自然變瘦、2食物消除脂肪最有效,https://health.tvbs.com.tw/regimen/328864,養生,聰明減肥,,
9成國人牙周不健康！彥寬老師早晚練「叩齒攪海法」 趕走慢性發炎、養出一口好牙,https://health.tvbs.com.tw/regimen/328863,養生,養生保健,,
T老師信箱／外送員被當病毒對待、被家人嫌髒怎麼辦？專家曝2方式應對 妙回「賺的錢髒嗎？」,https://health.tvbs.com.tw/life/328855,醫療,專家給問,,
壯男「性趣」缺缺、無精蟲原來是缺「這個」 治療3個月變「天天要」還做人成功,https://health.tvbs.com.tw/medical/328861,醫療,醫療焦點,,
免疫系統出事了！抗疫模範紐西蘭爆發致命病毒 醫揭「關鍵原因」,https://health.tvbs.com.tw/medical/328862,醫療,醫療焦點,,
這個動作超危險 互不相識的3樓和7樓住戶都染疫，原來上下樓都摸了「它」,https://health.tvbs.com.tw/medical/328860,醫療,醫療焦點,,
每天18人死於大腸癌！台大醫師曝5好習慣降大腸癌風險 4種蔬果要多吃,https://health.tvbs.com.tw/medical/328851,影音,名醫觀點,癌症,癌症飲食
新北市65歲以上莫德納疫苗接種時程曝光！侯友宜「67歲以上仍有1萬人可預約」,https://health.tvbs.com.tw/medical/328859,醫療,防疫快遞,,
唐鳳公布「疫苗預約平台」接種時程！最快7/16開始接種 未來3周都為AZ疫苗,https://health.tvbs.com.tw/medical/328858,醫療,防疫快遞,,
北農疫情獲控，聯合前進所解編！本土新增31例，另6死亡,https://health.tvbs.com.tw/medical/328857,醫療,防疫快遞,,
心肌炎是年輕人打疫苗的嚴重副作用？醫曝恐與「它」有關，２招有效預防,https://health.tvbs.com.tw/medical/328856,醫療,醫療焦點,,
長輩防疫無聊不知所措？線上「居家百寶箱」寫作業、做運動 動腦不退化,https://health.tvbs.com.tw/life/328854,壯世代,玩樂慢活,,
全職勞工也有紓困補助！因疫情薪資縮水到這程度，可申請1萬元補貼,https://health.tvbs.com.tw/life/328853,樂生活,過好日子,,
T老師信箱／隔離中父親去世、家人搶救中 不能祭拜如何讓往生家人靈魂安心？,https://health.tvbs.com.tw/life/328849,醫療,專家給問,,
鐵、鈣互斥，不能同時吃！保健營養品何時吃才對？一張表格讓你知,https://health.tvbs.com.tw/nutrition/328850,營養,營養對策,,
新北市公布最新疫苗接種對象！7/14起 65歲以上、原住民55歲以上 開放接種莫德納疫苗,https://health.tvbs.com.tw/medical/328848,醫療,防疫快遞,,
怕疫苗引血栓？醫師曝接種AZ後「保平安」3關鍵時間點,https://health.tvbs.com.tw/medical/328847,醫療,醫療焦點,,
變種病毒侵台！今新增32本土、12人亡，境外揪出Delta、Gamma、Alpha變種病毒,https://health.tvbs.com.tw/medical/328846,醫療,防疫快遞,,
36歲「詹皇」宛如生化人，滿身肌肉的祕密是禁牛肉？親揭吃這個最能長肌肉,https://health.tvbs.com.tw/nutrition/328845,養生,名人養生,,
「清冠一號」非人人適用！名中醫師大推「蔘杞菊防疫飲」 夏日清肝火、調節免疫力,https://health.tvbs.com.tw/regimen/328844,中醫,中醫治病,,
愛在疫起時／超強醫院防疫利器！5秒完勝新冠病毒 醫護工作更安心,https://health.tvbs.com.tw/medical/328843,醫療,防疫快遞,,
眼睛爆痛竟是殺菌燈惹禍！紫外線殺菌燈「這樣用」才不會傷眼,https://health.tvbs.com.tw/medical/328842,醫療,醫療焦點,,
打疫苗前要喝溫水＋維生素Ｃ？打完不能吃海鮮？醫師澄清：打疫苗前後注意11件事,https://health.tvbs.com.tw/medical/328841,醫療,醫療焦點,,
防疫快悶出病？4招解悶轉換情緒 專家教你：打掃、養植物心情變好,https://health.tvbs.com.tw/life/328840,樂生活,過好日子,,
愛在疫起時／夫妻同命染疫變重症 50年金婚醫護同慶，夫婦10指緊扣誓言更幸福,https://health.tvbs.com.tw/medical/328839,醫療,防疫快遞,,
長期戴口罩、護目鏡，耳朵痛臉壓傷！護理師「2法寶」超好用解決困擾,https://health.tvbs.com.tw/medical/328838,樂生活,過好日子,,
AZ疫苗接連到貨 全台50歲以上符合資格者快登記！選AZ有望先開打,https://health.tvbs.com.tw/medical/328836,醫療,防疫快遞,,
黃越綏復健痛到飆淚又漏尿！醫曝這動作最傷肩關節，尤其開車的人最容易犯,https://health.tvbs.com.tw/medical/328837,醫療,健康星聞,,
Delta變種病毒14秒就會傳染？蔬果、外送都可能染疫？醫曝感染Delta變種病毒3警訊症狀,https://health.tvbs.com.tw/medical/328835,醫療,醫療焦點,,
三級警戒微解封：餐飲可內用「5條件」出爐，自助餐要有專人分菜,https://health.tvbs.com.tw/life/328834,醫療,防疫快遞,,
搶救新冠肺炎快樂缺氧猝死！台大、台灣微軟開發「血氧即時監測平台」 醫護零接觸、精準掌握病情,https://health.tvbs.com.tw/medical/328833,醫療,防疫快遞,,
新北市公布最新疫苗接種對象！7/12起 67歲以上開放接種莫德納疫苗,https://health.tvbs.com.tw/medical/328832,醫療,防疫快遞,,
三級警戒延長到7/26 夜市、餐廳、電影院、健身房、遊樂園有條件鬆綁,https://health.tvbs.com.tw/medical/328830,醫療,防疫快遞,,
《六人行》男星自曝罹癌末期！「男性專屬癌」可怕在這裡 50歲以上注意,https://health.tvbs.com.tw/medical/328829,癌症,名人癌症,,
藝人風田打噴嚏竟腰閃到！打噴嚏千萬不能捏鼻子，三招預防受傷,https://health.tvbs.com.tw/medical/328831,醫療,健康星聞,,
林青霞眼被羽球擊中眼前全黑點 藉機治好白內障，小字都看得清清楚楚,https://health.tvbs.com.tw/medical/328828,醫療,健康星聞,,
做愛可以消氣、快速和好是真的嗎？兩性專家點名1種人不適用,https://health.tvbs.com.tw/life/328827,醫療,醫療焦點,,
夏天小心痛風來襲！吹冷氣會誘發痛風嗎？醫揭幕後元凶 這樣做降尿酸,https://health.tvbs.com.tw/medical/328826,醫療,醫療焦點,,
哪種乳製品鈣質最高？營養師點名5種人最要補鈣 2招鈣質吸收率大提升,https://health.tvbs.com.tw/nutrition/328825,營養,營養對策,,
這樣煲湯最鮮美 吃韓式牛骨冷湯麵免出國，主廚教您做,https://health.tvbs.com.tw/life/328824,樂生活,過好日子,,
愛在疫起時／愛心總鋪師創意料理「芒果鮮蝦滷麵」贈送給醫護人員，吃「芒」就不「忙」了！,https://health.tvbs.com.tw/medical/328823,醫療,防疫快遞,,
「小暑」陽氣最盛，清熱解毒怎麼吃？練一招不再心煩氣躁,https://health.tvbs.com.tw/regimen/328822,運動,氣功調氣,,
2兒童無症狀確診病毒量高！醫：警覺5個新冠輕症症狀,https://health.tvbs.com.tw/medical/328821,醫療,醫療焦點,,
蕭亞軒、王彩樺都被咬 防疫期間人狗壓力都不小，狗狗有4表現別靠近,https://health.tvbs.com.tw/medical/328820,醫療,健康星聞,,
T老師信箱／「去幫我買瓶醬油！」宅在家上班，為何媽媽老是忘記？解套３妙招,https://health.tvbs.com.tw/medical/328819,醫療,專家給問,,
華航地勤一家6口4人染疫！新北市確診者增14人 侯友宜公布確診者足跡,https://health.tvbs.com.tw/medical/328818,醫療,防疫快遞,,
濕氣重一身病！警告：10個習慣會加重體內濕氣，立刻學「排濕」6大法,https://health.tvbs.com.tw/regimen/328817,養生,養生保健,,
醫師娘養生祕訣！早上一杯「蒲公英淨化茶」 家族病史都沒找上她,https://health.tvbs.com.tw/nutrition/328816,養生,養生保健,,
今日新增39確診案例 機場地勤爆感染，下午大規模採檢,https://health.tvbs.com.tw/medical/328815,醫療,防疫快遞,,
4種狀況需與醫師討論！風濕免疫病人打疫苗5個大哉問,https://health.tvbs.com.tw/medical/328814,醫療,醫療焦點,,
不只Delta 秘魯Lambda變種病毒多點突變，傳播力更快恐成新威脅,https://health.tvbs.com.tw/medical/328813,醫療,防疫快遞,,
打新冠疫苗後副作用全身疼痛！中醫師教你快速減輕身體不適,https://health.tvbs.com.tw/medical/328812,養生,養生保健,,
防疫在家肩頸痠痛到不行！長期痠痛小心關節沾黏 中醫1招疏通氣血,https://health.tvbs.com.tw/medical/328811,中醫,中醫治病,,
皮膚過敏別只擦類固醇！營養師公開「6大護膚飲食習慣」 遠離敏感肌大爆發,https://health.tvbs.com.tw/nutrition/328807,養生,養生保健,,
夏天喝涼飲小心「咖啡因」危機！喝對好茶幫你補充水分同時喝進16種好食材！,https://health.tvbs.com.tw/Guangbian/328619,廣告業務,,,
命理專家曝下半年發大財4生肖、破財4星座！錢包放一物幫你擋惡運,https://health.tvbs.com.tw/life/328804,樂生活,命理星座,,
心靈苦悶無處醫、深山偏鄉就醫難 視訊醫療讓病友健康不中斷,https://health.tvbs.com.tw/medical/328810,醫療,醫療焦點,,
新冠病毒最害怕的食物組合！營養師公開「防疫餐盤」３大比例是關鍵,https://health.tvbs.com.tw/nutrition/328809,營養,營養對策,,
天氣愈熱，你愈有「味道」？減輕「狐臭味」有哪些方法？,https://health.tvbs.com.tw/medical/328808,養生,養生保健,,
掉髮、疲倦小心缺鐵！營養師教你「喝湯」補鐵去疲勞，5種家常湯很厲害,https://health.tvbs.com.tw/nutrition/328806,營養,營養對策,,
愛在疫起時／全家3口都確診 重症患者解隔離出院，感恩醫護照顧出院要愛地球,https://health.tvbs.com.tw/medical/328805,醫療,防疫快遞,,
男子吃荔枝險失明！荔枝一天吃幾顆才安全？營養師曝關鍵數字,https://health.tvbs.com.tw/medical/328803,營養,挑好食材,,
1922熱問／確診康復後，公司要求拿出陰性證明怎麼辦？,https://health.tvbs.com.tw/medical/328802,醫療,防疫快遞,,
愛在疫起時／確診者咳到頭暈 中醫治療13天「陽轉陰」！7/7起 台北市10家中醫診所視訊義診,https://health.tvbs.com.tw/medical/328801,醫療,防疫快遞,,
新北市最新防疫措施！7/8起幼兒園、安親班人員開放接種疫苗 商家防疫補助5萬,https://health.tvbs.com.tw/medical/328799,醫療,防疫快遞,,
幫長輩、孩子做居家快篩前，２件事要做好做滿,https://health.tvbs.com.tw/medical/328800,醫療,醫療焦點,,
對「外送食物包裝」一直噴酒精？醫：防疫「1動作」更安全,https://health.tvbs.com.tw/medical/328798,醫療,防疫快遞,,
本土確診27人、再添17死 ，其中3位死者40多歲都有「這問題」,https://health.tvbs.com.tw/medical/328797,醫療,防疫快遞,,
遇到Delta病毒BNT疫苗也投降？保護力降到64％，醫說預防重症和住院效果仍有93％,https://health.tvbs.com.tw/medical/328796,醫療,醫療焦點,,
快把疫苗接種卡拿出來！醫曝常見2大錯誤，當心出國被「卡」關,https://health.tvbs.com.tw/medical/328795,醫療,醫療焦點,,
居家快篩哪種最準確？採檢鼻咽、唾液有差嗎？台大醫師點名這種敏感度、特異性100％,https://health.tvbs.com.tw/medical/328794,醫療,醫療焦點,,
護理師打莫德納經驗分享：手痛到舉不起來！醫解析：3方法緩解新冠手臂,https://health.tvbs.com.tw/medical/328793,醫療,醫療焦點,,
吃對食物預防長白髮！營養師公開養髮祕訣 推薦「6大營養素」秀髮烏黑亮麗,https://health.tvbs.com.tw/nutrition/328792,營養,營養對策,,
50歲以上開始預約疫苗！手機、電腦、藥局、超商可預約，這幾個地區將最快打到,https://health.tvbs.com.tw/medical/328791,醫療,防疫快遞,,
打新冠疫苗手插腰、手臂下垂哪個姿勢才對？醫曝接種後1動作降低疫苗效果,https://health.tvbs.com.tw/medical/328788,醫療,醫療焦點,,
壓力大身心疲憊又失眠？睡前按「助眠3穴位」 一覺好眠、黑眼圈拜拜,https://health.tvbs.com.tw/regimen/328784,中醫,穴位保健,,
加熱也不怕！攝取茄紅素既能防癌、抗老還能提升免疫力,https://health.tvbs.com.tw/Guangbian/328772,廣告業務,,,
5秒鐘消滅81％新冠病毒！「紫外線抑菌艙」消毒更方便,https://health.tvbs.com.tw/medical/328790,醫療,醫療焦點,,
打完疫苗心驚驚？8大注意事項保平安 高燒出疹立刻就醫,https://health.tvbs.com.tw/medical/328789,醫療,醫療焦點,,
睡前7分鐘全身拉筋伸展 幫助血液循環、代謝廢物改善背痛,https://health.tvbs.com.tw/regimen/328787,運動,瑜伽伸展,,
腎友打完疫苗不可多喝水 水喝過多恐引發肺水腫,https://health.tvbs.com.tw/medical/328786,醫療,醫療焦點,,
醫師的話要聽！「226超鐵」夫妻檔十字韌帶斷裂 術後再創佳績,https://health.tvbs.com.tw/medical/328785,醫療,醫療焦點,,
為什麼減脂總是失敗？很多人都會犯這9個錯誤，不要「少吃一餐」,https://health.tvbs.com.tw/nutrition/328783,養生,聰明減肥,,
愛在疫起時／跟著神父、法師為台灣祈福！郁芳、沈春華、陳月卿邀您一起跨宗教線上祈禱,https://health.tvbs.com.tw/life/328782,樂生活,命理星座,,
新北市公布最新疫苗接種對象！7/6起公車、捷運駕駛開打 70歲以上長者開放預約,https://health.tvbs.com.tw/medical/328781,醫療,防疫快遞,,
補鈣別靠大骨湯，醫師教你「這樣吃」才對！骨折可以吃香蕉嗎？,https://health.tvbs.com.tw/medical/328780,營養,營養對策,,
本土確診28例，創3級警戒以來最低！台灣新冠肺炎死亡率高原來是這原因,https://health.tvbs.com.tw/medical/328779,醫療,防疫快遞,,
80歲台語歌王劉福助打疫苗前做2件事 注射後沒副作用,https://health.tvbs.com.tw/medical/328778,醫療,健康星聞,,
喝牛奶也能防疫！營養師曝5大「提升免疫營養素」 這些食物調節免疫力最有效,https://health.tvbs.com.tw/nutrition/328776,營養,營養對策,,
天氣爆熱！3招讓室溫降低，這樣吹電扇不輸冷氣效果,https://health.tvbs.com.tw/life/328777,樂生活,過好日子,,
發燒合併下背劇烈疼痛別大意！他一照Ｘ光腰椎盤被細菌蛀光,https://health.tvbs.com.tw/medical/328775,醫療,醫療焦點,,
「眼睛痠澀」可能也是染疫症狀！醫解析：COVID-19導致乾眼症4原因,https://health.tvbs.com.tw/medical/328774,醫療,醫療焦點,,
吃水果防疫！水果飯前吃還是飯後吃？營養師公開「最佳吃水果時間」 這種水果空腹吃恐傷身,https://health.tvbs.com.tw/nutrition/328773,營養,營養對策,,
肝不好眼睛快速退化！彥寬老師「疏肝明目功」 幫眼睛減壓、舒緩眼疲勞,https://health.tvbs.com.tw/regimen/328771,運動,氣功調氣,,
長輩最怕跌倒！撞到頭、骨折、外傷流血這樣做可保命,https://health.tvbs.com.tw/medical/328751,影音,名醫觀點,壯世代,熟年情報
T老師信箱／醫師怕傳染家人不敢回家住 真的好想念家人、小孩怎麼辦？,https://health.tvbs.com.tw/medical/328766,醫療,專家給問,,
7/4本土再+37例！北市持續超越新北 再爆疫情新熱點「虎林街」8個里,https://health.tvbs.com.tw/medical/328770,醫療,防疫快遞,,
嬤打莫德納後過世，指揮中心公布57件不良反應 專家說怕副作用可等次蛋白疫苗,https://health.tvbs.com.tw/medical/328769,醫療,防疫快遞,,
今日確診80人 指揮中心說疫情有控制，3市場疫情控制為首要任務,https://health.tvbs.com.tw/medical/328768,醫療,防疫快遞,,
北市市場篩檢3140人新增5例陽性 快篩後勤部隊連夜出動，只為快速防堵疫情擴大,https://health.tvbs.com.tw/medical/328767,醫療,防疫快遞,,
疫情下心肌梗塞病患平均晚40分鐘就醫 小心每拖30分鐘死亡率增7.5％,https://health.tvbs.com.tw/medical/328765,醫療,醫療焦點,,
這種油最好少吃！營養師點名4種食物 多吃容易高血壓、腦中風、心臟病、失智症,https://health.tvbs.com.tw/nutrition/328764,營養,營養對策,,
環南市場群聚感染13人住新北市！侯友宜「環南市場接觸史快來篩檢」,https://health.tvbs.com.tw/medical/328763,醫療,防疫快遞,,
防疫看病免出門，視訊看診 5步驟輕鬆搞定，但2 狀況速就醫,https://health.tvbs.com.tw/medical/328762,影音,如果云知道,樂生活,過好日子
T老師信箱／孩子，可以不要每5鐘叫一次媽嗎？心理師教你解套妙招,https://health.tvbs.com.tw/medical/328761,醫療,專家給問,,
今日確診58、15例亡 防環南市場疫情擴大，6/8至7/1曾赴市場者有症狀快篩檢,https://health.tvbs.com.tw/medical/328760,醫療,防疫快遞,,
環南市場篩檢再爆41人確診將休市3天 人員勿移動，待篩檢通知,https://health.tvbs.com.tw/medical/328759,醫療,防疫快遞,,
視力模糊撐著播4節氣象，美女主播誤為老花眼惡化 就醫驚爆視網膜2裂孔,https://health.tvbs.com.tw/medical/328758,醫療,健康星聞,,
嬰幼兒染疫無症狀比例高！食慾不振、腹瀉、嘔吐、脫水等重症預兆,https://health.tvbs.com.tw/medical/328757,醫療,醫療焦點,,
30歲青壯年染疫死亡！營養師曝1危險指標 3招大降新冠肺炎重症、死亡風險,https://health.tvbs.com.tw/medical/328756,醫療,醫療焦點,,
送愛給醫護！45秒就能吃到拉麵，「亞東戰神」張厚台示範點餐,https://health.tvbs.com.tw/life/328755,醫療,防疫快遞,,
防疫在家，如何預防肌少症？營養師教你：蛋白質、維生素D這樣吃,https://health.tvbs.com.tw/nutrition/328753,營養,營養對策,,
防疫在家輕鬆煮，美味健康就加主廚私推的「這一味」！,https://health.tvbs.com.tw/Guangbian/328754,廣告業務,,,
不只靠飲食!提升免疫力 專家點名這5項營養補充品,https://health.tvbs.com.tw/nutrition/328752,營養,營養對策,,
疫情期間可以做愛嗎？口交會感染嗎？兩性專家曝2種人不建議,https://health.tvbs.com.tw/life/328749,醫療,醫療焦點,,
1922熱問／COVID-19無症狀患者是否可以打疫苗？染疫康復後要打嗎？,https://health.tvbs.com.tw/medical/328748,醫療,防疫快遞,,
防疫茶越喝越虛，原來是這幾種藥材 醫師說換上白朮等3種防禦力更好,https://health.tvbs.com.tw/regimen/328750,養生,養生保健,,
Delta印度變種病毒傳染力高6成！江坤俊曝症狀像重感冒 打哪款新冠疫苗最有效？,https://health.tvbs.com.tw/medical/328747,醫療,醫療焦點,,
新北市莫德納疫苗明日開打！尚有3萬劑可預約 侯友宜呼籲長者踴躍接種,https://health.tvbs.com.tw/medical/328745,醫療,防疫快遞,,
「防疫胖」恐增重症風險！吃飯時，菜先吃還是湯先喝？７招讓你宅而不胖,https://health.tvbs.com.tw/medical/328746,養生,聰明減肥,,
天氣熱狂長痘痘怎麼辦？抗痘要用哪些產品？食藥署教你,https://health.tvbs.com.tw/medical/328744,醫療,醫療焦點,,
吃一碗乾拌麵鈉含量破千！營養師教你3招健康吃 搭配1食物排鈉最有效,https://health.tvbs.com.tw/nutrition/328743,營養,營養對策,,
本土個案數再降！指揮中心將啟動「入境普篩」,https://health.tvbs.com.tw/medical/328742,醫療,防疫快遞,,
防疫期間常熬夜會傷肝嗎？小心作息不正常不僅傷肝，全身都「害光光」,https://health.tvbs.com.tw/medical/328741,醫療,醫療焦點,,
新冠病毒會攻擊睪丸致不孕、陽萎！能不能「與人連結」？１口訣秒知,https://health.tvbs.com.tw/medical/328740,醫療,醫療焦點,,
70歲以上長者開放接種莫德納疫苗！營養師曝多吃2種魚、5招降低不舒服感,https://health.tvbs.com.tw/nutrition/328738,營養,營養對策,,
指甲也能看出有沒有染疫？醫師揭COVID-19患者指甲4大特徵,https://health.tvbs.com.tw/medical/328737,醫療,防疫快遞,,
別等渴了才喝水！「身體缺水」小心血栓、便祕、關節疼痛、腎功能下降,https://health.tvbs.com.tw/medical/328736,營養,營養對策,,
原來這道台灣菜護眼效果不輸葉黃素 蘿蔔乾一定要帶皮才有效,https://health.tvbs.com.tw/nutrition/328739,營養,挑好食材,,
打莫德納疫苗容易肌肉痠痛不適！3招降低施打後不舒服 調節身心焦慮壓力,https://health.tvbs.com.tw/regimen/328734,運動,瑜伽伸展,,
醫學生幫打疫苗新體驗 想成為病人最需要的醫師，喚起醫師魂老師說值得！,https://health.tvbs.com.tw/medical/328735,醫療,防疫快遞,,
選對便當可以少吃280大卡！14款木盒便當熱量大評比,https://health.tvbs.com.tw/nutrition/328733,養生,聰明減肥,,
不孕症擴大補助！我有不孕，該選擇做試管嬰兒嗎？會有哪些療程？,https://health.tvbs.com.tw/medical/328732,醫療,醫療焦點,,
可以戴口罩跑步、做運動嗎？台大醫師曝2種人千萬不要 少1動作當心染新冠肺炎,https://health.tvbs.com.tw/regimen/328731,醫療,防疫快遞,,
食物過敏會持續一輩子嗎？為何突然出現？注意「交叉反應」別吃錯！,https://health.tvbs.com.tw/medical/328730,醫療,醫療焦點,,
居家防疫當心肌力流失！這樣做長者練深蹲不傷膝蓋 運動學博士2招居家運動預防失能、肌少症,https://health.tvbs.com.tw/regimen/328729,壯世代,熟年情報,,
板橋大遠百櫃姊確診緊急快篩1500人！侯友宜「企業疏失擴大疫情得勒令停業」,https://health.tvbs.com.tw/medical/328727,醫療,防疫快遞,,
9旬老翁壓迫性骨折，補骨水泥仍痛不欲生！微創內固定手術重獲新生,https://health.tvbs.com.tw/medical/328728,醫療,醫療焦點,,
屏東Delta病毒群聚再擴大 41萬劑莫德納疫苗今到貨,https://health.tvbs.com.tw/medical/328725,醫療,防疫快遞,,
T老師信箱／高齡的爸爸怕染疫又怕打疫苗，Delta病毒來襲怎麼辦？,https://health.tvbs.com.tw/medical/328726,醫療,專家給問,,
花蓮慈濟守護孕媽咪，幫百位施打莫德納 還有診所為媽咪先產檢再打疫苗保心安,https://health.tvbs.com.tw/medical/328724,醫療,防疫快遞,,
睡不好該喝什麼？營養師教你喝這5種，產生睡意放鬆好睡,https://health.tvbs.com.tw/nutrition/328723,營養,營養對策,,
飯後胃謅謅不舒服？勤練1招保腸健胃、改善胃脹氣,https://health.tvbs.com.tw/regimen/328722,運動,氣功調氣,,
愛在疫起時／急診護理師懷孕40周確診新冠肺炎！台大緊急剖腹救命、護理師幫擠奶 染疫媽媽好感動,https://health.tvbs.com.tw/medical/328721,醫療,防疫快遞,,
